{
  "$schema": "https://json-schema.org/draft/2020-12/schema",
  "$id": "talent.schema.json",
  "title": "タレントデータ（talents/<slug>/talent.json）",
  "description": "1人分のブラインドプロフィールの中身。実名・連絡先・SNS・現職の社名は入れない。",
  "type": "object",
  "required": ["initials", "role", "overview", "career"],
  "additionalProperties": false,
  "properties": {
    "$schema": { "type": "string" },
    "_note": { "type": "string", "description": "作業メモ。資料には出ない" },
    "initials": {
      "type": "string",
      "pattern": "^[A-Z](\\.[A-Z])+\\.$",
      "description": "イニシャル表記（例: K.K.）。姓名の順は問わないが資料内で統一する"
    },
    "role": {
      "type": "string",
      "minLength": 1,
      "description": "肩書き（例: Corporate Ops / AI Automation Lead）。実績に見合う表現にする"
    },
    "issued": {
      "type": "string",
      "pattern": "^[0-9]{4}\\.[0-9]{2}$",
      "description": "発行年月（例: 2026.08）。省略時は生成日"
    },
    "availability": {
      "enum": ["available", "partially_available", "on_assignment", "unavailable"],
      "default": "available",
      "description": "稼働状況。資料上のラベルは available=稼働可能 / partially_available=一部稼働可 / on_assignment=稼働中（時期応相談） / unavailable=稼働調整中"
    },
    "photo": {
      "type": ["string", "null"],
      "description": "同じフォルダにある写真ファイル名（jpg/png/webp/svg）。null または未指定ならイニシャルの枠を出す"
    },
    "facts": {
      "type": "object",
      "description": "基本情報6項目。null のものはブランド既定値で埋まる",
      "additionalProperties": false,
      "properties": {
        "hours": { "type": ["string", "null"], "description": "稼働目安（例: 月 40h〜）" },
        "hoursNote": { "type": ["string", "null"], "description": "稼働目安の注記（例: 増減ご相談可）" },
        "rate": { "type": ["string", "null"], "description": "参考単価の表示（例: 15,000円/h〜）。未記入ならブランド既定" },
        "rateNote": { "type": ["string", "null"], "description": "参考単価の注記" },
        "start": { "type": ["string", "null"], "description": "稼働開始（例: 即日（応相談））" },
        "contract": { "type": ["string", "null"], "description": "契約形態" },
        "workStyle": { "type": ["string", "null"], "description": "勤務スタイル（例: フルリモート主体）" },
        "focus": { "type": ["string", "null"], "description": "希望領域。全角20文字以内が目安" }
      }
    },
    "overview": {
      "type": "array",
      "minItems": 1,
      "maxItems": 3,
      "items": { "type": "string", "minLength": 1 },
      "description": "概要の段落。**太字** が使える。2段落が基本（1段落目=何者かと一番の強み、2段落目=いまの取り組みと評価されている点）"
    },
    "coverage": {
      "type": "object",
      "additionalProperties": false,
      "properties": {
        "roles": { "$ref": "#/$defs/strings", "description": "役割（例: コンサル / AI戦略設計）" },
        "jobFields": { "$ref": "#/$defs/strings", "description": "職種（例: 経営企画 / 事業企画）" },
        "industries": { "$ref": "#/$defs/strings", "description": "業界（例: SaaS / IT / Web）" }
      }
    },
    "fit": {
      "type": "array",
      "minItems": 1,
      "maxItems": 5,
      "items": { "type": "string", "minLength": 1 },
      "description": "「解決できる課題」。読み手（エンド企業）が抱える状況を客観の文で、各1行（全角35字以内）。3点が目安。口語や呼びかけにしない（例: CRMを導入したが入力が定着せず、数値の信頼性が低い）。案件があればその要件から、無ければ本人のプロジェクトが実際に解いた課題から書く。書くと1ページ目が 概要→解決できる課題→推薦理由 の構成になり、対応領域は2ページ目に移る"
    },
    "points": {
      "type": "array",
      "minItems": 1,
      "maxItems": 5,
      "items": { "type": "string", "minLength": 1 },
      "description": "「推薦理由」。上の課題に対応する実績を数字で、各1〜2行（全角50字目安）・**太字**は1箇所。4点が目安。文末は「〜できる」「〜の知見を持つ」のような事実の言い切りにし、売り文句にしない"
    },
    "career": {
      "type": "array",
      "minItems": 1,
      "items": {
        "type": "object",
        "required": ["period", "org", "headline"],
        "additionalProperties": false,
        "properties": {
          "period": { "type": "string", "description": "期間の表示（例: 2013 — 2025 / 2021 — 現在）" },
          "org": { "type": "string", "description": "所属の表示。現職・自社は業種表現にする（例: IPO準備企業）" },
          "title": { "type": ["string", "null"], "description": "役職（例: 取締役 → 代表取締役CSO）" },
          "note": { "type": ["string", "null"], "description": "所属欄の注記（例: ※社名はご面談時に開示）" },
          "headline": { "type": "string", "description": "その期間の要約見出し" },
          "body": { "type": ["string", "null"], "description": "担当と成果。数字は出典どおりに書き、創作しない" }
        }
      }
    },
    "skills": {
      "type": "array",
      "items": {
        "type": "object",
        "required": ["group", "items"],
        "additionalProperties": false,
        "properties": {
          "group": { "type": "string", "description": "分類名（例: LLM / AIコーディングツール）" },
          "level": { "type": ["string", "null"], "description": "習熟の表示（例: 実務 / 個人開発）" },
          "items": { "$ref": "#/$defs/strings" }
        }
      }
    },
    "projects": {
      "type": "array",
      "items": {
        "type": "object",
        "required": ["name"],
        "additionalProperties": false,
        "properties": {
          "name": { "type": "string" },
          "badge": { "type": ["string", "null"], "description": "右肩の小さな表示（例: 社内利用 / 公開）" },
          "subtitle": { "type": ["string", "null"], "description": "一言の説明" },
          "body": { "type": ["string", "null"], "description": "何を、どこまで担ったか" },
          "tools": { "type": ["string", "null"], "description": "主な利用ツール（例: Claude Code・GitHub・Vercel）" },
          "featured": { "type": "boolean", "default": false, "description": "代表的なものを true にする（2件が目安）" }
        }
      }
    },
    "layout": {
      "type": "object",
      "additionalProperties": false,
      "properties": {
        "pages": {
          "type": "array",
          "minItems": 1,
          "items": {
            "type": "array",
            "minItems": 1,
            "items": { "enum": ["hero", "facts", "overview", "fit", "points", "coverage", "career", "skills", "projects", "cta"] }
          },
          "description": "ページ割りを手で決めたいときだけ指定する。省略時は 3ページ（プロジェクトが無ければ 2ページ）。fit / points があるときは1ページ目が 概要・解決できる課題・推薦理由、2ページ目が 対応領域・経歴・スキル になる"
        }
      }
    }
  },
  "$defs": {
    "strings": { "type": "array", "items": { "type": "string", "minLength": 1 } }
  }
}
